gelain,kanten,agar,pectin,sugar,ranpaku,ranou,cream,milk,yogurt,cheese,liquid,others,labels,title,title_id,tsukurepo_no,summery,ingredients,tsukurepos,onomatopea_variation,ぷるぷる,ふわふわ,ふるふる,しっかり,もちもち,柔らかい,軽い,べちゃっ,ゆるゆる,ぷりっ,ねっとり,硬い,むちむち,もったり,ほわっ,歯ごたえ,ほくほく,どっしり,ぐちゃっ,ぶるんぶるん,ぷにぷに,くたっ,ぶりんぶりん,からっ,ぶりっ,重い,ガリガリ,ふかふか,ぽってり,シャクシャク,ぼてっ,もろもろ,コリッ,ねっちり,ぶるぶる,ガリッ,ジャリジャリ,ねばねば,もさもさ,べたっ,だらだら,ふにゃっ,sep,なめらか,とろっ,つるっ,とろける,クリーミー,まったり,ミルキー,すかっ,口どけがよい,とろん,ジューシー,薄い,ごろごろ,どろっ,口あたりがよい,こってり,さらり,ずっしり,ぎっしり,するっ,細かい,厚い,脂っこい,均一な,ぶつぶつ,でこぼこ,ジュワジュワ,ころころ,ざらざら,たらたら,つまった,水っぽい,乾いた,粗い,粉っぽい,じゅるじゅる,phrased_sentences
0.027439024,0,0,0,0.018292683,0,0,0,0.640243902,0,0,0,0.304878049,['ゼラチン ムース'],バレンタインに！固めるだけのチョコムース,6577014,113,ぷるんとなめらか、ミルクとチョコレートのまろやかな甘さがたまらない♪おうちバレンタインにもぴったりなチョコムース☆,"{'チョコレート': ['100g'], '牛乳': ['200ml'], '砂糖': ['小さじ2'], '粉ゼラチン': ['小さじ1（約3g）'], '水（ゼラチンふやかす用）': ['大さじ1']}","グラサージュ掛けました！簡単にできるのが素晴らしいお味も最高半量で作ったけど簡単で美味しかったです!こし器がなくて省いたら二層になり失敗…。再チャレンジします!!簡単にできました。濃厚で美味しかったですが甘めだったのでフルーツを添えて頂きました。ゼラチン少し減らしてビターチョコとマシュマロ1つとラム酒とココア粉入れて作りました！ふわふわし過ぎず生っぽく濃厚で狙った通りに♪簡単に出来ました！濃厚で美味しかったですとても簡単に、美味しいチョコムースができました！デコレーションも可愛くテンションアップです。
簡単、可愛い！小3の娘と一緒に作りました。次はもう1人で作れる！って言っています！ピックだけでスタイリッシュな仕上がりに。濃いめに作りました！美味！旗を足して気分も上がります♪子どもと作りましたが簡単なのに美味しい！家族みんなでペロリブラックチョコで♪可愛いし好評でした！溶かし、混ぜ、冷やすだけで美味しいデザートできて嬉しい!息子達も「美味しい！！また作って」と大絶賛でした♪
お手軽に作れるので、普段のおやつにも良いな～と思います♪簡単だけどﾌﾗｯｸﾞつけるだけでドレスアップした感じ。濃厚なチョコムース美味しいです(^^)簡単なのでまた作りたいです子どもと一緒につくりました^ ^ピックも簡単に作れていいですね簡単に作れました混ぜて固めるだけで美味しくできました!フラッグのデコレーションも可愛くて、楽しいバレンタインデーになりました。簡単でおいしいだけでなく、フラッグでかわいらしさもプラス！こんなメッセージカードを添えたら喜ばれました＾＾子供と一緒に作りました。フラッグで一気に華やかになりいいですね！簡単にオシャレデコレーションになりました♪簡単10分で完成！時間をかけずに可愛いくて美味しいムースが作れました。濃厚で美味しくお店の味のようでした。デコもかわいいしまた作ります今年のバレンタインに二人の息子とパパに。大喜びでした！簡単だけど濃厚で美味しかったです。簡単だけど見た目も可愛くてすごく喜んでもらえました！チョコの濃厚な味が美味しかったです！飾り付けも、子どもたちが楽しんでやってくれました♪バレンタインじゃなくても作りたいです！！混ぜて固めるだけなので、娘と簡単に作れました。ピックも可愛い～♪固めるだけですぐできておいしい！飾りでかわいさアップ♪忙しくても家事の合間に簡単に出来ました。ムースと言うより濃厚なチョコプリンな感じ。簡単で美味しくできて満足です◎息子も喜んでくれて良かったです！子供と作りました。少し固めになってしまいましたが、簡単で美味しかったです。濃厚なチョコ味、作った自分もビックリの美味しさでした。息子にどうやって作ったの?と聞かれ、簡単過ぎて教えようか迷いましたw濃厚で美味しかったです。凄く簡単なのに濃厚でした！リピ決定です♪♪3歳の子供と楽しく簡単に作れました。すごく簡単でミルクチョコで作ったら5歳の娘でも食べやすい甘くてマイルドなチョコムースに仕上がりました簡単おいしくてきました！初めてのムースも上手に出来ました！上にオレオを砕いてトッピングしました！
子供たちだけで作成！フラッグが有るのと無いのとでは楽しさや盛り上がりが全然違います！簡単でかわいくできました！美味しくてみんな喜んでくれました！子供が楽しんで飾り付けをしてくれました！華やかになって良き簡単なのに濃厚なめらかムースが出来ちゃいました　ホイップとイチゴをトッピング簡単なのにとっても濃厚可愛いピックで子供達大喜びです。とても濃厚で美味しいです！ピックも可愛い！簡単なのに美味しい～いちごと粉砂糖でさらにかわいく
5人家族なのでそのままの量で5等分に。かわいく出来ました♪６才の娘と作りました♪チョコ濃厚で満足★材料少ないのにクオリティー高い！しかもかわいい娘と作りました。簡単で美味しくて可愛いと大満足です。パパの分も無くなってしまうくらい人気でした。子供と一緒に作りました☆飾り付けするだけで豪華に見えますね(^-^)簡単にチョコムースが出来るんですね♪これからは手軽に作りたいです！フラグを付けるだけでメチャ可愛い！娘にピックを作って貰いました。次は可愛いカップで作ります！濃厚チョコムースが簡単に作れました♪可愛いフラッグに子供達大喜び5歳、3歳の子どもと一緒に作りました！手作りりんごジャムも添えてビターチョコで甘さ控えめに。子どもたちも大喜びでした混ぜて固めるだけ子どもたちと一緒に作りました。おうちバレンタイン！レシピありがとうございます簡単で美味しいのでパーティーにもピッタリ！！ピックを刺すだけで特別な感じになりますねほんっとにおいしかったです！家族にも大好評で喜ばれましたゼラチン入れすぎて固くなってしまった！リベンジするぞ！チョコを溶かすの簡単で楽♪濃厚チョコ味でとってもおいしく、ちびっこはフラッグ作りも楽しめてよかったです(^-^)濃厚♪簡単美味しく出来ました☆可愛いプリントで気分が上がります♪ピックが可愛い～とっても簡単で美味しいのでまた作ります♪簡単に出来て美味しかったです。ピックでとても可愛くなりました♪簡単に出来ました♪生クリーム使わなくても濃厚で美味しかったです簡単！濃厚で美味しい仕上がりです。飾り付けで華やかに簡単ですぐに作り終わりました。ピックが可愛くて色々使いたいです簡単てとっても美味しくできました！牛乳だからヘルシー可愛らしくできました^ ^ また作ります♪固めるだけで簡単！濃厚で美味～フラッグで豪華になりました☆小1娘と作りましたとても簡単なのに、可愛くて美味しい仕上がりに大満足♪また作りたいです！娘と一緒に作りました！！簡単で美味しい！！滑らかなムース(o^∀^o)また作ります！！簡単で、ひんやり美味しいスイーツの出来上がり！POPも可愛いとても簡単に可愛く出来ました。濃厚でなめらかなチョコムースです。「めちゃくちゃ美味しい！」と子供たちに大好評でした(*^^*)とっても美味しかったです！ありがとうございました(^^)/かわいくおいしくできました！ボトムにラズベリージャムを入れてうまー。少ない材料でとっても濃厚なチョコムースができました！見た目も可愛くて子どもも喜んでいました。簡単にデコれて可愛くできました♪またリピして作りたいです。簡単にできました！濃厚で美味しかったです♪濃厚で口当たりのよいチョコムースが簡単にできました。ピックもかわいい♪子供にもお手伝いしてもらいながら楽しく出来ました。旗を作るだけでイベント感が出て素敵ですね♪子どもと作りました♪簡単で美味しいです＾＾また作りますとにかく簡単！ビターチョコ使用で甘過ぎず大人にもちょうどいい甘さでした。ちょこってなんでもおいしい！ゼラチンで簡単なめらか～♪漉しは必須です(｀･ω･´)ゞすっごい簡単でした♪砂糖は入れなくても十分だったかも？濃厚で美味しいっ!
イチゴも乗せてみました美味しい！と子供達が喜んで食べてました(*^^*)簡単にできました♪美味しくて可愛くて主人も大喜びバレンタインパーティにも是非～簡単で美味しかったです！次は子どもと作ります★固めるだけで手軽なのにプルプルで美味甘さも丁度良いです♪フラッグも可愛くて、どの旗にするか盛り上がり笑子供達大喜びでしたちゃんと濾さなかったら、分離してしまいましたが濃厚で美味！苺と生クリームトッピング。簡単美味しい。そして可愛くなりましたとっても美味しいチョコムースが簡単にできてうれしいです。プルプルおいしかったです！あまり甘くないのも良いですね。豆乳でも濃厚に出来ました！思ったより手順も少なく簡単♪チョコ好きの子どもに好評でしたチョコの美味しさが凝縮！ひんやり冷たいムースでのどごし爽やか♪ぷるぷる、美味しかった。本番も作ります。メッセージは、内緒です。簡単にできました。甘過ぎないので年代問わずに喜ばれますね。なめらかなチョコムース、とても美味しかったです。バレンタインにピッタリですね！子供が美味い！と言ってくれました
ビックリするほど簡単で、子どもでもできると思いました。味も本格的で、これならホワイトと二層にしてもいいな。リッチな配合で濃厚。可愛くて美味しくてバレンタインデーにピッタリビターチョコで作ったので甘すぎず、甘いもの苦手な息子も喜。子供と楽しく作りました！！ホイップといちごもトッピング！簡単に美味しくできました！(^^)子供たちでも簡単に作ることが出来ました！ブラックチョコレートで大人の味に。主人も喜んでくれました。滑らかプリンが手軽に！ホワイトチョコやベリーチョコでリピします子供が作ったピックで、デコ！子供と作りました！すごく簡単でとても美味しかったです！濃厚で美味しかったですバレンタインの練習に。簡単でなめらかな食感がたまらないです♪",6,4,1,0,0,0,0,0,0,0,0,0,0,0,0,0,0,0,0,0,0,0,0,0,0,0,0,0,0,0,0,0,0,0,0,0,0,0,0,0,0,0,0,mechanic/geomet,8,0,0,0,0,0,0,0,0,0,0,0,0,0,0,0,0,0,0,0,0,0,0,0,0,0,0,0,0,0,0,0,0,0,0,0, グラサージュ 掛け ました 簡単 に できる の が 素晴らしい お味 も 最高 半量 で 作ったけど 簡単 で 美味しかった で すこし器 が なく て 省い たら 二層 に なり 失敗 。 再チャレンジします 簡単 に できました 。 濃厚 で 美味しかったです が 甘めだったので フルーツ を添え て 頂きました 。 ゼラチン 少し減らし て ビター チョコ と マシュマロつとラム酒 と ココア 粉 入れ て 作りました ふわふわ し過ぎず生っぽく 濃厚 で 狙っ た 通り に 簡単 に 出来ました 濃厚 で 美味しかったです とても 簡単 に 、 美味しい チョコムース が できました デコレーション も 可愛く テンションアップ です 。 簡単 、 可愛い 小 の 娘と一緒 に 作りました 。 次は もう 人 で 作れる って言っ てい ます ピック だけ で スタイリッシュ な 仕上がり に 。 濃いめ に 作りました 美味 旗 を 足し て 気分 も 上がり ます 子ども と 作りました が 簡単なのに 美味しい 家族みんな で ペロリブラックチョコ で 可愛い し 好評でした 溶かし 、 混ぜ 、 冷やすだけ で 美味しい デザート でき て 嬉しい 息子達 も 美味しい また作って と 大絶賛でした お手軽 に 作れるので 、 普段 の おやつ に も 良い な と思います 簡単 だけど つける だけ で ドレスアップした感じ 。 濃厚 な チョコムース 美味しい です 簡単 なので また作りたい です 子どもと一緒 に つくりました ピック も 簡単 に 作れ て いいですね 簡単 に 作れ ました 混ぜ て 固めるだけ で 美味しくできました フラッグ の デコレーション も 可愛く て 、 楽しい バレンタインデー に なりました 。 簡単 で おいしい だけ で なく 、 フラッグ で かわいらしさ も プラスこんなメッセージカードを添えたら喜ばれ ました 子供と一緒 に 作りました 。 フラッグ で 一気に 華やか に なり いいですね 簡単 に オシャレデコレーション に なりました 簡単 分 で 完成 時間 をかけ ず に 可愛いく て 美味しい ムース が 作れ ました 。 濃厚 で 美味しく お店 の 味 の よう でした 。 デコ も かわいい し また作ります 今年 の バレンタイン に 二人 の 息子 と パパ に 。 大喜びでした 簡単 だけど 濃厚 で 美味しかったです 。 簡単 だけど 見た目 も 可愛く て すごく 喜んでもらえました チョコ の 濃厚 な 味 が 美味しかったです 飾り付け も 、 子どもたち が 楽しん で やってくれました バレンタイン じゃなく て も 作りたい です 混ぜ て 固めるだけ なので 、 娘 と 簡単 に 作れ ました 。 ピック も 可愛い 固めるだけ で すぐ でき て おいしい 飾り で かわいさアップ忙しく て も 家事 の 合間 に 簡単 に 出来ました 。 ムース と 言うより 濃厚 な チョコ プリン な 感じ 。 簡単 で 美味しくでき て 満足 です 息子 も 喜んでくれ て 良かった です 子供 と 作りました 。 少し 固め に なってしまいました が 、 簡単 で 美味しかったです 。 濃厚 な チョコ 味 、 作った 自分 も ビックリ の 美味しさ でした 。 息子 に どうやっ て 作った の と 聞かれ 、 簡単 過ぎ て 教えようか迷い ました w 濃厚 で 美味しかったです 。 凄く 簡単なのに 濃厚 でした リピ決定 です 歳 の 子供 と 楽しく 簡単 に 作れ ました 。 すごく 簡単 で ミルク チョコ で 作ったら 歳 の 娘 で も 食べやすい 甘く て マイルド な チョコムース に 仕上がり ました 簡単 おいしく て き ました 初めて の ムース も 上手 に 出来ました 上 に オレオ を 砕い て トッピング しました 子供たち だけ で 作成フラッグ が 有る の と 無い の と で は 楽しさや盛り上がり が 全然違い ます 簡単 で かわいくできました 美味しくて みんな 喜んでくれました 子供 が 楽しん で 飾り付け を してくれました 華やか に なって 良き 簡単なのに 濃厚 なめらか ムース が 出来 ちゃいました ホイップ と イチゴ を トッピング 簡単 な の にとっても 濃厚 可愛い ピック で 子供達 大喜び です 。 とても 濃厚 で 美味しい です ピック も 可愛い 簡単なのに 美味しい いちご と 粉砂糖 で さらに かわいく 人 家族 なので そのまま の 量 で 等分 に 。 かわいく 出来ました 才 の 娘 と 作りました チョコ 濃厚 で 満足材料少ないのにクオリティー高いしかもかわいい 娘 と 作りました 。 簡単 で 美味しくて 可愛い と 大満足 です 。 パパ の 分 も 無くなっ て しまうくらい人気 でした 。 子供と一緒 に 作りました 飾り付け する だけ で 豪華 に 見えますね 簡単 に チョコムース が 出来るんですね これから は 手軽 に 作りたい です フラグ を 付ける だけ で メチャ 可愛い 娘 に ピック を 作って 貰い ました 。 次は 可愛い カップ で 作ります 濃厚 チョコムース が 簡単 に 作れ ました 可愛い フラッグ に 子供達 大喜び 歳 、 歳 の 子どもと一緒 に 作りました 手作り りんご ジャム も 添え て ビター チョコ で 甘さ控えめ に 。 子どもたち も 大喜びでした 混ぜ て 固めるだけ 子どもたち と一緒 に 作りました 。 おうち バレンタイン レシピありがとうございます 簡単 で 美味しい ので パーティー に も ピッタリ ピック を 刺すだけ で 特別 な 感じ に なりますねほんっと に おいしかったです 家族 に も 大好評 で 喜ばれました ゼラチン 入れすぎ て 固くなっ て しまったリベンジするぞ チョコ を 溶かす の 簡単 で 楽 濃厚 チョコ 味 で とっても おいしく 、 ちびっこ は フラッグ 作り も 楽しめ て よかった です 濃厚 簡単 美味しく出来ました 可愛い プリント で 気分 が 上がり ます ピック が 可愛い とっても 簡単 で 美味しい ので また作ります 簡単 に 出来 て 美味しかったです 。 ピック で とても 可愛く なりました 簡単 に 出来ました 生クリーム 使わなく て も 濃厚 で 美味しかったです 簡単 濃厚 で 美味しい 仕上がり です 。 飾り付け で 華やか に 簡単 で すぐ に 作り 終わり ました 。 ピック が 可愛く て 色々 使い たい です 簡単 て とっても 美味しくできました 牛乳 だから ヘルシー 可愛らしく できました また作ります 固めるだけ で 簡単 濃厚 で 美味 フラッグ で 豪華 に なりました 小娘 と 作りました とても 簡単なのに 、 可愛く て 美味しい 仕上がり に 大満足 また作りたい です 娘と一緒 に 作りました 簡単 で 美味しい 滑らか な ムース oo また作ります 簡単 で 、 ひんやり 美味しい スイーツ の 出来上がりPOP も 可愛い とても 簡単 に 可愛く 出来ました 。 濃厚 で なめらか な チョコムース です 。 めちゃくちゃ 美味しい と 子供たち に 大好評でした とっても美味しかったです ありがとうございましたかわいくおいしくできましたボトム に ラズベリージャム を 入れ て うまー 。 少ない材料 で とっても 濃厚 な チョコムース が できました 見た目 も 可愛く て 子ども も 喜んでい ました 。 簡単 に デコれ て 可愛くできましたまたリピし て 作りたい です 。 簡単 に できました 濃厚 で 美味しかったです 濃厚 で 口当たり の よい チョコムース が 簡単 に できました 。 ピック も かわいい 子供 に も お手伝い して もらい ながら 楽しく 出来ました 。 旗 を 作る だけ で イベント 感 が 出 て 素敵 ですね 子ども と 作りました 簡単 で 美味しい です また作ります とにかく 簡単 ビターチョコ 使用 で 甘過ぎず 大人 に も ちょうどいい甘さ でした 。 ちょこってなん でも おいしい ゼラチン で 簡単 なめらか 漉し は 必須 です すっごい 簡単 でした 砂糖 は 入れ なく て も 十分 だった か も 濃厚 で 美味しいっ イチゴ も 乗せてみました 美味しい と 子供達 が 喜んで食べ て ました 簡単 に できました 美味しくて 可愛く て 主人 も 大喜び バレンタイン パーティ に も 是非 簡単 で 美味しかったです 次は 子ども と 作ります 固めるだけ で 手軽 なのに プルプル で 美味 甘さ も 丁度良い です フラッグ も 可愛く て 、 どの旗 に する か 盛り上がり 笑 子供達大喜びでしたちゃんと濾さなかったら 、 分離してしまいました が 濃厚 で 美味 苺 と 生クリーム トッピング 。 簡単 美味しい 。 そして 可愛く なりました とっても 美味しい チョコムース が 簡単 に でき て うれしい です 。 プルプル おいしかったです あまり 甘く ない の も 良いですね 。 豆乳 でも 濃厚 に 出来ました 思ったより 手順 も 少なく 簡単 チョコ 好き の 子ども に 好評でした チョコ の 美味しさ が 凝縮ひんやり冷たい ムース で のどごし 爽やか ぷるぷる 、 美味しかった 。 本番 も 作ります 。 メッセージ は 、 内緒 です 。 簡単 に できました 。 甘過ぎないので年代問わず に 喜ばれますね 。 なめらか な チョコムース 、 とても 美味しかったです 。 バレンタイン に ピッタリ ですね 子供 が 美味いと言ってくれましたビックリするほど 簡単 で 、 子ども でも できると思い ました 。 味 も 本格的 で 、 これなら ホワイト と 二層 に して も いい な 。 リッチな配合 で 濃厚 。 可愛く て 美味しくて バレンタインデー に ピッタリビターチョコ で 作ったので 甘すぎず 、 甘いもの苦手な 息子 も 喜 。 子供 と 楽しく 作りました ホイップ と いちご も トッピング 簡単 に 美味しくできました 子供たち で も 簡単 に 作ること が 出来ました ブラックチョコレート で 大人 の 味 に 。 主人 も 喜んでくれました 。 滑らか プリン が 手軽 に ホワイトチョコ や ベリー チョコ で リピします 子供 が 作った ピック で 、 デコ 子供 と 作りました すごく 簡単 で とても 美味しかったです 濃厚 で 美味しかったです バレンタイン の 練習 に 。 簡単 で なめらか な 食感 が たまらない です 
0.030397506,0,0,0,0.116913484,0,0,0.249415433,0,0.187061574,0.311769291,0,0.093530787,['ゼラチン ムース'],柚子香るブルーベリーレアチーズムース,6133032,0,柚子香るふわっふわのレアチーズムースにドライワイルドブルーベリーの淡い紫色と甘酸っぱさがコーヒーにも紅茶にもピッタリ,"{'プレーンヨーグルト無糖': ['120g (1/2カップ)'], 'クリームチーズ': ['200g'], 'グラニュー糖(砂糖)': ['75g'], '粉ゼラチン': ['7g'], '水(ゼラチン用)': ['大さじ2 (30cc)'], '柚子果汁（レモン果汁で代用可）': ['大さじ1/2'], '生クリーム(脂肪35-38%)': ['160g（3/4カップ）'], 'ドライワイルドブルーベリー': ['60g']}",,1,0,1,0,0,0,0,0,0,0,0,0,0,0,0,0,0,0,0,0,0,0,0,0,0,0,0,0,0,0,0,0,0,0,0,0,0,0,0,0,0,0,0,mechanic/geomet,0,0,0,0,0,0,0,0,0,0,0,0,0,0,0,0,0,0,0,0,0,0,0,0,0,0,0,0,0,0,0,0,0,0,0,0, 
0.018348624,0,0,0,0.036697248,0.183486239,0.122324159,0,0.305810398,0,0,0,0.305810398,['ゼラチン ムース'],生クリーム無しでキャラメルムース,6103435,0,生クリームを使わずにムースのように仕上げたキャラメル風味のムース風デザートです。ふんわり軽い新食感です。,"{'○卵黄': ['２個'], '○砂糖': ['大さじ１'], '○牛乳': ['１００ｇ'], '●板ゼラチン': ['６ｇ'], '※カラメルソース（ID5107031）': ['１００ｇ'], '★卵白': ['２個分'], '★砂糖': ['小さじ１']}",,3,0,1,0,0,0,0,1,0,0,0,0,0,0,0,0,0,0,0,0,0,0,0,0,0,0,0,0,0,0,0,0,0,0,0,0,0,0,0,0,0,0,0,mechanic/geomet,0,0,0,0,0,0,0,0,0,0,0,0,0,0,0,0,0,0,0,0,0,0,0,0,0,0,0,0,0,0,0,0,0,0,0,0, 
