gelain,kanten,agar,pectin,sugar,ranpaku,ranou,cream,milk,yogurt,cheese,liquid,others,labels,title,title_id,tsukurepo_no,summery,ingredients,tsukurepos,onomatopea_variation,ぷるぷる,ふわふわ,ふるふる,しっかり,もちもち,柔らかい,軽い,べちゃっ,ゆるゆる,ぷりっ,ねっとり,硬い,むちむち,もったり,ほわっ,歯ごたえ,ほくほく,どっしり,ぐちゃっ,ぶるんぶるん,ぷにぷに,くたっ,ぶりんぶりん,からっ,ぶりっ,重い,ガリガリ,ふかふか,ぽってり,シャクシャク,ぼてっ,もろもろ,コリッ,ねっちり,ぶるぶる,ガリッ,ジャリジャリ,ねばねば,もさもさ,べたっ,だらだら,ふにゃっ,sep,なめらか,とろっ,つるっ,とろける,クリーミー,まったり,ミルキー,すかっ,口どけがよい,とろん,ジューシー,薄い,ごろごろ,どろっ,口あたりがよい,こってり,さらり,ずっしり,ぎっしり,するっ,細かい,厚い,脂っこい,均一な,ぶつぶつ,でこぼこ,ジュワジュワ,ころころ,ざらざら,たらたら,つまった,水っぽい,乾いた,粗い,粉っぽい,じゅるじゅる,phrased_sentences
0.010976948,0,0,0,0.006586169,0,0,0,0.345773875,0,0,0,0.636663008,['ゼラチン ムース'],葱のふんわり豆腐と豆乳のムース,4301490,0,とても口当たりが良く、栄養も満点！お出汁の風味と葱の香りが良く優しい一品,"{'葱(青い部分も含め)': ['60㌘'], '絹ごし豆腐': ['150㌘'], '豆乳': ['150cc'], 'ホタテ顆粒だし': ['小さじ1'], '白だし': ['小さじ1/2'], 'お湯': ['80cc'], 'ゼラチン': ['5㌘'], 'レッドペッパー': ['適量'], '◎葱(白い部分)': ['3㎝幅 1片'], '◎お酢': ['小さじ1'], '◎オリーブオイル': ['小さじ1'], '◎砂糖': ['小さじ1/2']}",,1,0,1,0,0,0,0,0,0,0,0,0,0,0,0,0,0,0,0,0,0,0,0,0,0,0,0,0,0,0,0,0,0,0,0,0,0,0,0,0,0,0,0,mechanic/geomet,0,0,0,0,0,0,0,0,0,0,0,0,0,0,0,0,0,0,0,0,0,0,0,0,0,0,0,0,0,0,0,0,0,0,0,0, 
0.003903201,0,0,0,0.119437939,0.023419204,0.015612802,0.078064012,0.011709602,0,0,0,0.6245121,['ゼラチン ムース'],スキムミルクでキウイのムース,4289762,0,キウイのピューレで、牛乳ではなく、スキムミルクを使ったムース。ふんわり感がちょうど良いムースです。,"{'■': ['上掛け'], 'キウイフルーツ（皮をむいて）': ['４００ｇ'], '砂糖': ['１５０ｇ'], 'キルシュワッサー': ['大さじ２'], '●水': ['１００'], '●スキムミルク': ['大さじ１'], '●卵黄': ['１個分'], '●砂糖': ['小さじ１'], '△板ゼラチン': ['８ｇ'], '★上記キウイピューレ': ['２００ｇ'], '※生クリーム(砂糖）': ['１００ｇ（小さじ１）'], '○卵白（砂糖）': ['１個（小さじ２分の１）'], '上記キウイピューレ': ['２００ｇ'], '板ゼラチン': ['５ｇ']}",,1,0,1,0,0,0,0,0,0,0,0,0,0,0,0,0,0,0,0,0,0,0,0,0,0,0,0,0,0,0,0,0,0,0,0,0,0,0,0,0,0,0,0,mechanic/geomet,0,0,0,0,0,0,0,0,0,0,0,0,0,0,0,0,0,0,0,0,0,0,0,0,0,0,0,0,0,0,0,0,0,0,0,0, 
0.013550136,0,0,0,0.024390244,0,0,0,0.284552846,0.54200542,0,0,0.135501355,['ゼラチン ムース'],簡単！ヘルシーヨーグルトと豆乳のムース,4182249,7,ヨーグルトと豆乳のぷるぷるムース風デザートです！ほんのり甘酸っぱくてさっぱり美味しい！ダイエット中、妊娠中のおやつにも♪,"{'★ヨーグルト': ['200g'], '★豆乳': ['100cc'], '★砂糖': ['大1'], '★レモン汁': ['小1'], 'お湯': ['50cc'], 'ゼラチン': ['5g']}",空気が入ってしまいましたが、美味しかったです！簡単にできて美味しいです！豆乳の消化にも助かりました。簡単でおいしかったです( ´∞` )またリピします！！とても簡単で美味しいです。マシュマロ乗っけても良かったですプルプルで美味しかったです★ホットレモンのもとで簡単に！とっても美味しかったです(*^▽^*すごく美味しかったです！何回もリピして子どもと一緒に頂いてます☆,1,2,0,0,0,0,0,0,0,0,0,0,0,0,0,0,0,0,0,0,0,0,0,0,0,0,0,0,0,0,0,0,0,0,0,0,0,0,0,0,0,0,0,mechanic/geomet,0,0,0,0,0,0,0,0,0,0,0,0,0,0,0,0,0,0,0,0,0,0,0,0,0,0,0,0,0,0,0,0,0,0,0,0, 空気 が 入ってしまいました が 、 美味しかったです 簡単 に でき て 美味しい です 豆乳 の 消化 に も 助かりました 。 簡単 で おいしかったです またリピします とても 簡単 で 美味しい です 。 マシュマロ乗っけ て も 良かった です プルプル で 美味しかったです ホットレモン の もと で 簡単 にとっても 美味しかったです すごく 美味しかったです 何回 も リピし て 子どもと一緒 に 頂い て ます 
0.008849558,0,0,0,0.084955752,0,0,0.17699115,0.088495575,0,0,0,0.375221239,['ゼラチン ムース'],ハロウィンにも☆簡単ふわとろ南瓜のムース,4150938,4,子供も大好き＾＾簡単に作れるふんわり南瓜ムースです。普段のおやつにも＾＾,"{'■': ['トッピング用生クリーム'], '南瓜ペースト（市販の物や、加熱後裏ごしした物）': ['200g'], '砂糖（南瓜の甘さで加減）': ['45～48g（①30～33g（あればきび砂糖）+②15g）'], '牛乳': ['50g'], '生クリーム（乳脂肪分35％）': ['150g'], 'バニラエッセンス': ['少々'], '粉ゼラチン': ['5g強（55g）'], '生クリーム（乳脂肪分42％）': ['100g'], 'グラニュー糖': ['12g']}",リピです♪家族にも大人気なスイーツでとにかく美味しすぎです生クリームが食べれない為メープルで頂きました♪美味しかったです♪かぼちゃの優しい味で美味しかったです♪すっっごく美味しかったです旦那も感激！手間かけても作る価値有♪,1,0,1,0,0,0,0,0,0,0,0,0,0,0,0,0,0,0,0,0,0,0,0,0,0,0,0,0,0,0,0,0,0,0,0,0,0,0,0,0,0,0,0,mechanic/geomet,0,0,0,0,0,0,0,0,0,0,0,0,0,0,0,0,0,0,0,0,0,0,0,0,0,0,0,0,0,0,0,0,0,0,0,0, リピ です 家族 に も 大人気 な スイーツ で とにかく 美味しすぎ です 生クリーム が 食べれ ない 為 メープル で 頂きました 美味しかったです かぼちゃ の 優しい味 で 美味しかったです すっっごく 美味しかったです 旦那 も 感激 手間 かけ て も 作る価値有 
0.015296367,0,0,0,0.095602294,0.057361377,0,0,0,0.669216061,0,0.057361377,0.105162524,['ゼラチン ムース'],好きなジャムでヨーグルトムース,4082976,0,生クリームなしでふわふわのムースができますよ。お好みのジャムを使って色々なお味を楽しんでみね,"{'ヨーグルト(無糖)': ['３５０ｇ'], '粉ゼラチン': ['８ｇ'], '水': ['大匙2'], 'レモン汁': ['大匙1'], '蜂蜜': ['２５ｇ'], 'ジャム': ['３０ｇ'], '■': ['イタリアンメレンゲ'], '卵白': ['1個分'], '砂糖': ['５０ｇ']}",,1,0,1,0,0,0,0,0,0,0,0,0,0,0,0,0,0,0,0,0,0,0,0,0,0,0,0,0,0,0,0,0,0,0,0,0,0,0,0,0,0,0,0,mechanic/geomet,0,0,0,0,0,0,0,0,0,0,0,0,0,0,0,0,0,0,0,0,0,0,0,0,0,0,0,0,0,0,0,0,0,0,0,0, 
0.010989011,0,0,0,0.10989011,0,0,0.21978022,0,0.549450549,0,0,0.10989011,['ゼラチン ムース'],つぶつぶみかんヨーグルトムース,4069034,1,つぶつぶみかんが入ったふわふわヨーグルトのムースです( ´ ▽ ` 人）是非一度試してみて(*^^*),"{'ヨーグルト': ['500g'], '生クリーム': ['200cc'], '砂糖': ['80～100g'], 'ゼラチン': ['10g'], 'みかん缶汁': ['100cc'], 'みかん缶': ['1缶'], 'レモン汁': ['小さじ1/2']}","みかんのつぶつぶがおいしかったです！
",1,0,1,0,0,0,0,0,0,0,0,0,0,0,0,0,0,0,0,0,0,0,0,0,0,0,0,0,0,0,0,0,0,0,0,0,0,0,0,0,0,0,0,mechanic/geomet,0,0,0,0,0,0,0,0,0,0,0,0,0,0,0,0,0,0,0,0,0,0,0,0,0,0,0,0,0,0,0,0,0,0,0,0, みかん の つぶつぶ が おいしかったです 
0.019975031,0,0,0,0.024968789,0,0,0.124843945,0.131086142,0,0,0.149812734,0.124843945,['ゼラチン ムース'],ハロウィン蜘蛛の巣おばけかぼちゃムース,3920212,19,話題入り感謝＆ｸｯｸﾊﾟｯﾄﾞﾏｶﾞｼﾞﾝNo.8/ﾊﾛｳｨﾝｽｲｰﾂ掲載かぼちゃﾑｰｽにﾏｼｮﾏﾛおばけが魅力的♪,"{'■': ['デコレーションの材料'], 'かぼちゃ': ['1/4個分(300g)'], '砂糖': ['10g'], '牛乳': ['50ml'], '★生クリーム': ['150ml'], '★砂糖(生クリーム用)': ['20g'], 'ゼラチン': ['8g'], '水': ['大さじ４'], 'ラム酒(お好みで)': ['大さじ1'], 'オレオクッキー': ['40g'], 'マショマロ(半円型/円型)': ['6個'], 'デコペン(チョコレート)': ['1本(10g)'], '生クリーム': ['50ml'], 'アラザン(お好みで)': ['適量']}","すぐ出来てフワフワなめらか☆みんなで美味しくいただきました☆すごく濃厚で美味しかった！ハロウィンに。素敵レシピ感謝^^*友人の誕生日ケーキに、1人分サイズで！ふわふわ甘々☆オレオはサクサク☆素敵なレシピに感謝です(^^)タルト生地に乗せました！美味しかったです長女の誕生日☆中にムースを使わせて頂きました♪美味～！ありがとうお友達のお誕生日に、娘と作りました。とても喜んでもらえましたムースがふわっと甘過ぎず、オレオの塩気が合いますね(^^簡単なのでまた作ります。美味しいと好評でした！ふわっとして美味しかったです(^○^)是非リピしたいです！飾りやボトム無しですがとっても美味しかったです簡単でとっても美味しい(*´ω｀*)薩摩芋でも挑戦してみます♪ハロウィン過ぎましたが、かぼちゃスイーツ楽しく作れました♪マシュマロなかったので上はクッキーに♪ムースふわふわで好評でしたトッピングはしてないけれど…とっても美味でしたリピしたいです！蜘蛛の巣、難しかったですが頑張りました！息子も喜んで食べましたチョコムースと２段で
カボチャムースが濃厚で美味しかったですかぼちゃムースがとっても美味しかったです！マシュマロはクッキーで代用。子供も大人にも好評でした☆",3,0,7,0,0,0,0,0,0,0,0,0,0,0,0,0,0,0,0,0,0,0,0,0,0,0,0,0,0,0,0,0,0,0,0,0,0,0,0,0,0,0,0,mechanic/geomet,1,0,0,0,0,0,0,0,0,0,0,0,0,0,0,0,0,0,0,0,0,0,0,0,0,0,0,0,0,0,0,0,0,0,0,0, すぐ 出来 て フワフワ なめらか みんな で 美味しくいただきました すごく 濃厚 で 美味しかった ハロウィン に 。 素敵レシピ感謝 友人 の誕生日ケーキ に 、 人分サイズ で ふわふわ 甘々 オレオ は サクサク 素敵なレシピ に 感謝 です タルト生地 に 乗せ ました 美味しかったです 長女 の誕生日 中 に ムース を 使わせて頂き ました 美味 ありがとう お友達 の お誕生日 に 、 娘 と 作りました 。 とても 喜んでもらえました ムース が ふわっと 甘過ぎず 、 オレオ の 塩気 が 合いますね 簡単 なので また作ります 。 美味しい と 好評でした ふわっと して 美味しかったです 是非リピしたい です 飾り や ボトム 無し です が とっても美味しかったです 簡単 で とっても 美味しい 薩摩芋 で も 挑戦してみますハロウィン過ぎ ました が 、 かぼちゃ スイーツ 楽しく作れ ました マシュマロ なかったので 上 は クッキー に ムース ふわふわ で 好評でした トッピング は して ないけれど とっても 美味でした リピしたい です 蜘蛛 の 巣 、 難しかった です が 頑張り ました 息子 も 喜んで食べ ました チョコムース と 段 で カボチャ ムース が 濃厚 で 美味しかったです かぼちゃ ムース が とっても美味しかったです マシュマロ は クッキー で 代用 。 子供 も 大人 に も 好評でした 
0.015384615,0,0,0,0.076923077,0,0,0.307692308,0,0,0,0.384615385,0.215384615,['ゼラチン ムース'],ふわふわグァバのムース,4031371,0,口あたりをよくしたくて、生クリームを使い濃厚感もプラスしてみました。,"{'グァバ': ['約15㎏(約20個)'], '■': ['               正味、280g(500cc)なりました'], '水': ['300cc'], '砂糖': ['100g'], '☆ゼラチン': ['20g'], '☆水': ['200cc'], '生クリーム': ['400cc']}",,3,0,1,0,0,0,0,0,0,0,0,0,0,0,0,0,0,0,0,0,0,0,0,0,0,0,0,0,0,0,0,0,0,0,0,0,0,0,0,0,0,0,0,mechanic/geomet,0,0,0,0,0,0,0,0,0,0,0,0,0,0,1,0,0,0,0,0,0,0,0,0,0,0,0,0,0,0,0,0,0,0,0,0, 
0.004531722,0,0,0,0.013595166,0,0,0.302114804,0,0.377643505,0,0.151057402,0.151057402,['ゼラチン ムース'],★簡単！美味しい＊ヨーグルトムース＊♪,3993662,0,糖質制限の方にもおススメ!!ふわふわなめらかムースあんずジャムソースをのせた美味しいヨーグルトムースです♪,"{'ヨーグルト(プレーン)': ['２５０g'], '生クリーム(植物性)': ['２００g'], 'パルスイート（砂糖でも可）': ['大さじ１'], 'レモン汁(ポッカレモン)': ['大さじ１'], '★粉ゼラチン': ['３g'], '★水': ['１００㏄'], '■': ['あんずジャムソース'], 'あんずジャム': ['１００g']}",,2,0,1,0,0,0,0,0,0,0,0,0,0,0,0,0,0,0,0,0,0,0,0,0,0,0,0,0,0,0,0,0,0,0,0,0,0,0,0,0,0,0,0,mechanic/geomet,1,0,0,0,0,0,0,0,0,0,0,0,0,0,0,0,0,0,0,0,0,0,0,0,0,0,0,0,0,0,0,0,0,0,0,0, 
