gelain,kanten,agar,pectin,sugar,ranpaku,ranou,cream,milk,yogurt,cheese,liquid,others,labels,title,title_id,tsukurepo_no,summery,ingredients,tsukurepos,onomatopea_variation,ぷるぷる,ふわふわ,ふるふる,しっかり,もちもち,柔らかい,軽い,べちゃっ,ゆるゆる,ぷりっ,ねっとり,硬い,むちむち,もったり,ほわっ,歯ごたえ,ほくほく,どっしり,ぐちゃっ,ぶるんぶるん,ぷにぷに,くたっ,ぶりんぶりん,からっ,ぶりっ,重い,ガリガリ,ふかふか,ぽってり,シャクシャク,ぼてっ,もろもろ,コリッ,ねっちり,ぶるぶる,ガリッ,ジャリジャリ,ねばねば,もさもさ,べたっ,だらだら,ふにゃっ,sep,なめらか,とろっ,つるっ,とろける,クリーミー,まったり,ミルキー,すかっ,口どけがよい,とろん,ジューシー,薄い,ごろごろ,どろっ,口あたりがよい,こってり,さらり,ずっしり,ぎっしり,するっ,細かい,厚い,脂っこい,均一な,ぶつぶつ,でこぼこ,ジュワジュワ,ころころ,ざらざら,たらたら,つまった,水っぽい,乾いた,粗い,粉っぽい,じゅるじゅる,phrased_sentences
0.010460251,0,0,0,0.037656904,0,0,0.418410042,0.010460251,0.209205021,0,0,0.313807531,['ゼラチン ムース'],可愛いいちごのヨーグルトムース,5001336,9,爽やかなヨーグルトムースの上に甘酸っぱいいちごソースたっぷりのせました春の香りたっぷりなデザートです,"{'■': ['いちごソース'], '生クリーム': ['200ml'], 'プレーンヨーグルト': ['100g'], '砂糖': ['大さじ2'], 'コンデンスミルク': ['あれば小さじ1'], '粉ゼラチン': ['5g'], 'お湯': ['50ml'], 'いちご': ['100g(4～5粒程度)'], 'レモン汁': ['小さじ1']}","味も見た目も最高でした。素敵レシピありがとう(*'▽'*)♪簡単に出来て美味しい♪
見栄えも良いしリピ確定です(´∀`)家族から大好評でした苺とめっちゃあいます～サッパリウマウマですね簡単でとってもおいしかったです!!子供たちも喜んでくれました!!ムースを失敗してしまいましたが（笑）生クリーム消費助かりました☆今夜のデザートに。やっと作りました。食べるの楽しみです(^^)とても美味しいでした。新しいレシピが楽しみです。フルーツサンド材料余りで♪口どけ滑らかふんわり♪ソースも絶妙です",3,0,1,0,0,0,0,0,0,0,0,0,0,0,0,0,0,0,0,0,0,0,0,0,0,0,0,0,0,0,0,0,0,0,0,0,0,0,0,0,0,0,0,mechanic/geomet,1,0,0,0,0,0,0,0,1,0,0,0,0,0,0,0,0,0,0,0,0,0,0,0,0,0,0,0,0,0,0,0,0,0,0,0, 味 も 見た目 も 最高 でした 。 素敵レシピありがとう 簡単 に 出来 て 美味しい 見栄え も 良い し リピ確定 です 家族 から 大好評でした 苺 と めっちゃ あい ます サッパリウマウマ ですね 簡単 で とっても おいしかったです 子供たち も 喜んでくれました ムース を 失敗してしまいました が 笑 生クリーム 消費 助かりました 今夜 の デザート に 。 やっと 作りました 。 食べる の 楽しみ です とても 美味しい でした 。 新しい レシピ が 楽しみ です 。 フルーツ サンド 材料 余り で 口どけ 滑らか ふんわり ソース も 絶妙 です 
0.01453958,0,0,0,0,0,0,0.242326333,0,0,0,0.096930533,0.323101777,['ゼラチン ムース'],ふんわりなめらか大人の苺ムース,4931224,0,イチゴの季節に一度は作りたい甘酸っぱくて美味しいムースです。,"{'いちご': ['約100g'], 'グラニュー糖': ['100g'], '粉ゼラチン': ['大さじ1'], '白ワイン（あれば甘口）': ['大さじ4'], '生クリーム': ['200cc'], 'レモン汁・コアントロー': ['各大さじ1'], '（飾り用）生クリーム': ['150cc'], 'グラニュー糖、キルシュ': ['各大さじ1']}",,2,0,1,0,0,0,0,0,0,0,0,0,0,0,0,0,0,0,0,0,0,0,0,0,0,0,0,0,0,0,0,0,0,0,0,0,0,0,0,0,0,0,0,mechanic/geomet,1,0,0,0,0,0,0,0,0,0,0,0,0,0,0,0,0,0,0,0,0,0,0,0,0,0,0,0,0,0,0,0,0,0,0,0, 
0.099206349,0,0,0,0,0,0,0.198412698,0,0.396825397,0,0,0.297619048,['ゼラチン ムース'],ジャムで簡単にふわふわムース,4938971,0,市販のジャムを使って作る簡単なムースです。,"{'ジャム': ['150g'], '生クリーム': ['100g'], '無糖ヨーグルト': ['200g'], '板ゼラチン': ['4g'], 'ゼラチン用のお湯': ['50g'], '食用色素（今回は粉を使いました）': ['適量']}",,1,0,1,0,0,0,0,0,0,0,0,0,0,0,0,0,0,0,0,0,0,0,0,0,0,0,0,0,0,0,0,0,0,0,0,0,0,0,0,0,0,0,0,mechanic/geomet,0,0,0,0,0,0,0,0,0,0,0,0,0,0,0,0,0,0,0,0,0,0,0,0,0,0,0,0,0,0,0,0,0,0,0,0, 
0.012345679,0,0,0,0.049382716,0,0,0.24691358,0,0.37037037,0,0.074074074,0.24691358,['ゼラチン ムース'],苺ヨーグルトムース,4923126,1,苺とヨーグルトのふんわりムースです。,"{'ゼラチン': ['5g'], '水': ['30g'], '苺': ['100g程度'], 'ヨーグルト': ['苺と合わせて150g'], '生クリーム': ['100g'], '砂糖': ['20g']}",下に苺ソースを入れました。冷蔵庫で冷やします。おやつが楽しみです,1,0,1,0,0,0,0,0,0,0,0,0,0,0,0,0,0,0,0,0,0,0,0,0,0,0,0,0,0,0,0,0,0,0,0,0,0,0,0,0,0,0,0,mechanic/geomet,0,0,0,0,0,0,0,0,0,0,0,0,0,0,0,0,0,0,0,0,0,0,0,0,0,0,0,0,0,0,0,0,0,0,0,0, 下 に 苺 ソース を 入れ ました 。 冷蔵庫 で 冷やし ます 。 おやつ が 楽しみ です 
0.047619048,0,0,0,0.171428571,0,0,0,0.666666667,0,0,0,0,['ゼラチン ムース'],お餅入りモチモチふわふわ簡単ムース風,4881182,0,たくさんあるお餅を白玉風にしてみました。優しい味なのでお餅入りでもたくさん食べれちゃいます！,"{'お餅': ['1つ'], '苺': ['お好きな量'], '牛乳': ['200ml'], '粉ゼラチン': ['15ｇ'], '砂糖(苺)': ['大さじ4'], '砂糖(お餅)': ['大さじ2']}",,2,0,1,0,0,1,0,0,0,0,0,0,0,0,0,0,0,0,0,0,0,0,0,0,0,0,0,0,0,0,0,0,0,0,0,0,0,0,0,0,0,0,0,mechanic/geomet,0,0,0,0,0,0,0,0,0,0,0,0,0,0,0,0,0,0,0,0,0,0,0,0,0,0,0,0,0,0,0,0,0,0,0,0, 
0.012987013,0,0,0,0.025974026,0,0,0.519480519,0,0,0,0.12987013,0.311688312,['ゼラチン ムース'],おせちリメイクのもっちり黒豆ムース,4878807,0,ディ◯ダにも見える簡単！黒豆ムース！,"{'黒豆煮': ['約120g'], '生クリーム': ['200ml'], '砂糖': ['10g'], '粉ゼラチン': ['5g'], '水': ['50ml'], '飾り用 栗の甘露煮': ['4個'], '飾り用 黒豆煮': ['8個']}",,1,0,0,0,0,1,0,0,0,0,0,0,0,0,0,0,0,0,0,0,0,0,0,0,0,0,0,0,0,0,0,0,0,0,0,0,0,0,0,0,0,0,0,mechanic/geomet,0,0,0,0,0,0,0,0,0,0,0,0,0,0,0,0,0,0,0,0,0,0,0,0,0,0,0,0,0,0,0,0,0,0,0,0, 
0.009041591,0,0,0,0,0,0,0.361663653,0,0,0,0.452079566,0.162748644,['ゼラチン ムース'],ふわふわ苺のムース,4872844,0,水をあまり使わずに仕上げた泡たて器不要のふわふわ～なムースです＾＾,"{'生クリーム': ['２００ｃｃ'], '苺': ['５～６個'], '★グラニュー糖': ['４０ｇ'], '★粉ゼラチン': ['８ｇ'], '★水': ['５０ｃｃ'], '■': ['飾り'], 'ポッカレモン': ['１０ｃｃ'], '水': ['２００ｃｃ'], 'グラニュー糖': ['４０ｇ'], '粉ゼラチン': ['５ｇ'], 'ブルーベリー': ['１４個'], 'ミントの葉': ['７本'], 'アラザン（ピンク、シルバー）': ['適量']}",,1,0,2,0,0,0,0,0,0,0,0,0,0,0,0,0,0,0,0,0,0,0,0,0,0,0,0,0,0,0,0,0,0,0,0,0,0,0,0,0,0,0,0,mechanic/geomet,0,0,0,0,0,0,0,0,0,0,0,0,0,0,0,0,0,0,0,0,0,0,0,0,0,0,0,0,0,0,0,0,0,0,0,0, 
0.01384083,0,0,0,0,0,0,0.138408304,0.07266436,0,0,0.069204152,0.567474048,['ゼラチン ムース'],ミキサーで作るふわふわイチゴのムース,4838823,0,ミキサーで混ぜるだけ！生クリームを加えてふわふわで美味しいムースになります,"{'いちご': ['400g'], 'グラニュー糖': ['10g'], '牛乳': ['50cc'], 'レモン汁': ['大さじ1'], '粉ゼラチン': ['10g'], '水': ['50cc'], '生クリーム（ムース用）': ['100cc'], '生クリーム（飾り用）': ['100cc']}",,1,0,2,0,0,0,0,0,0,0,0,0,0,0,0,0,0,0,0,0,0,0,0,0,0,0,0,0,0,0,0,0,0,0,0,0,0,0,0,0,0,0,0,mechanic/geomet,0,0,0,0,0,0,0,0,0,0,0,0,0,0,0,0,0,0,0,0,0,0,0,0,0,0,0,0,0,0,0,0,0,0,0,0, 
0.098425197,0,0,0,0.035433071,0,0,0,0,0.656167979,0,0.104986877,0.104986877,['ゼラチン ムース'],アイスとジャムでふわふわヨーグルトムース,4842140,0,生クリームって常備しにくいけど、バニラアイスならいつもある！コクとふわふわな舌ざわりが手軽に実現。お口で溶ける～,"{'■': ['材料Ｂ'], 'プレーンヨーグルト': ['500g'], 'ブルーベリージャム': ['1/2びん（80gぐらい）'], 'ポッカレモン': ['小さじ2'], '砂糖(上白糖)': ['大さじ3'], 'バニラアイス': ['1個'], '粉ゼラチン': ['15袋（75gくらい）'], '水': ['80cc']}",,2,0,2,0,0,0,0,0,0,0,0,0,0,0,0,0,0,0,0,0,0,0,0,0,0,0,0,0,0,0,0,0,0,0,0,0,0,0,0,0,0,0,0,mechanic/geomet,0,0,0,0,0,0,0,0,0,0,0,0,0,0,0,0,0,0,0,0,0,0,0,0,0,0,0,0,0,0,0,0,0,0,0,0, 
0.014778325,0,0,0,0,0,0,0.246305419,0,0.246305419,0.246305419,0.073891626,0.147783251,['ゼラチン ムース'],フランボワーズとレアチーズのムース,4804630,2,フランボワーズ（ラズベリー）とレアチーズのムース。,"{'■': ['フランボワーズゼリー'], 'クリームチーズ': ['50g'], 'グラニュー糖': ['5g'], 'プレーンヨーグルト（無糖）': ['50g'], '◎粉ゼラチン': ['05g'], '◎水（ゼラチン用）': ['小さじ1'], '生クリーム': ['50g'], 'フランボワーズピューレ': ['25g'], 'レモン果汁': ['小さじ1/2'], '水': ['大さじ1']}",主人の誕生日に作りました～しっかりしたムースで、セルクルで作ればホールにも出来そうでした！,1,0,0,0,1,0,0,0,0,0,0,0,0,0,0,0,0,0,0,0,0,0,0,0,0,0,0,0,0,0,0,0,0,0,0,0,0,0,0,0,0,0,0,mechanic/geomet,0,0,0,0,0,0,0,0,0,0,0,0,0,0,0,0,0,0,0,0,0,0,0,0,0,0,0,0,0,0,0,0,0,0,0,0, 主人の誕生日に 作りました しっかり した ムース で 、 セルクル で 作れ ば ホール に も 出来 そう でした 
0.007092199,0,0,0,0.11820331,0,0,0.236406619,0.354609929,0,0,0,0.283687943,['ゼラチン ムース'],ほっこりかぼちゃムース（卵無し）,4739298,6,ハロウィンにも♪ほくほくほっくり美味しいカボチャをたっぷり使った卵不使用ムースです。,"{'かぼちゃ（冷凍品を使用）': ['正味120g'], '砂糖': ['50g'], '牛乳': ['150g'], '板ゼラチン（パウダーでも可）': ['2枚（3g）'], '生クリーム（Whipping cream)': ['100g'], 'バニラエッセンス': ['少々']}","ほっこり濃厚かぼちゃムースができました
冷凍かぼちゃで楽々でしたハロウィンに作りました。当たりの南瓜だったようで色も濃ゆい(^w^)シュワっとふんわり♪美味しい！濃厚美味！此方のレシピ大好きです～また作ります！滑らかでとっても美味しかったですキラキラ飾りました感謝ですすんごーーーく美味！簡単で美味しくて言うことなしだったよー",4,0,1,0,0,0,0,0,0,0,0,0,0,0,0,0,0,2,0,0,0,0,0,0,0,0,0,0,0,0,0,0,0,0,0,0,0,0,0,0,0,0,0,mechanic/geomet,1,0,0,0,0,0,0,0,0,0,0,0,0,0,0,0,0,0,0,0,0,0,0,0,0,0,0,0,0,0,0,0,0,0,0,0, ほっこり 濃厚 かぼちゃ ムース が できました 冷凍 かぼちゃ で 楽々 でした ハロウィン に 作りました 。 当たり の 南瓜 だった よう で 色 も 濃ゆいwシュワっとふんわり 美味しい 濃厚 美味 此方 の レシピ 大好き です また作ります 滑らか で とっても美味しかったです キラキラ 飾り ました 感謝 で すすんごーーーく 美味 簡単 で 美味しくて 言うことなしだったよー 
0.066666667,0,0,0,0,0,0,0,0,0.41025641,0,0,0.512820513,['ゼラチン ムース'],ハチミツレモンのふわふわヨーグルトムース,4692973,0,季節が変わる頃登場する、期間限定のメロンやレモンのカルピスを使って簡単に作れるムース♪滑らかな口当たりと優しい味です,"{'希釈タイプのカルピス シチリア産レモンはちみつ仕立て': ['80cc(常温)'], 'お好みのヨーグルト(無糖)': ['200g'], 'お好みのクリーム': ['170cc'], 'はちみつ': ['大さじ1弱'], '森永クックゼラチン': ['5g'], 'お湯（森永クックゼラチンの表記参照)': ['50cc']}",,2,0,1,0,0,0,0,0,0,0,0,0,0,0,0,0,0,0,0,0,0,0,0,0,0,0,0,0,0,0,0,0,0,0,0,0,0,0,0,0,0,0,0,mechanic/geomet,1,0,0,0,0,0,0,0,0,0,0,0,0,0,0,0,0,0,0,0,0,0,0,0,0,0,0,0,0,0,0,0,0,0,0,0, 
0.011709602,0,0,0,0.06323185,0,0,0,0,0.702576112,0,0.105386417,0.117096019,['ゼラチン ムース'],爽やかカルピス味♪ヨーグルトベリームース,4656020,0,思い立ったらすぐできる！混ぜるだけ簡単デザートです♪ふるふる食感にヨーグルト＋カルピスで爽やか風味。夏にぴったりです,"{'プレーンヨーグルト': ['300g'], 'カルピス(原液)': ['50cc'], '砂糖(蜂蜜でも◎)': ['大さじ3'], '水': ['大さじ3'], 'ゼラチン': ['5g'], '冷凍ブルーベリー(好きな果物で♪)': ['適量']}",,2,0,0,1,0,0,0,0,0,0,0,0,0,0,0,0,0,0,0,0,0,0,0,0,0,0,0,0,0,0,0,0,0,0,0,0,0,0,0,0,0,0,0,mechanic/geomet,0,0,0,0,0,0,0,0,0,0,0,0,0,0,0,0,0,0,0,0,0,0,0,0,0,0,0,0,0,0,0,0,0,0,0,0, 
0.032846715,0,0,0,0,0,0,0.018248175,0.383211679,0,0,0,0.191605839,['ゼラチン ムース'],ストロベリーチョコレートオレオのムース,4650690,4,ストロベリーチョコで作るミルキーでふわふわ甘～いイチゴの香りのオレオ入りムースですミルメークいちご味も入れてます＾＾,"{'ストロベリーチョコ': ['６０ｇ'], '★牛乳': ['２００ｃｃ'], '★ミルメーク（いちご味）': ['１５ｇ（５ｇ入り３袋）'], '★上白糖': ['３０ｇ'], '★ラム酒かお好みの洋酒（あれば）': ['小さじ１杯'], 'ゼラチン': ['５ｇ'], 'ゼラチンをふやかす水': ['大さじ２杯'], '生クリーム': ['２００ｃｃ'], '上白糖（生クリーム用）': ['１０ｇ'], 'バニラオイル（ストロベリーエッセンスでも）': ['数滴'], 'オレオ': ['５～１０枚ほど'], '純ココアパウダー（トッピングに）': ['適量']}","カプリコのあたまトッピング♪オレオムースシリーズ美味しいこちらは苺ジュレをのせて
(｡-∀-)素敵レシピアップ感謝 やっと作れました (*ﾉ´∀`*)ﾉ
苺オレオヤバいわ超美味
またまたつくりました。めっちゃおいしー(*^^*)",2,0,1,0,0,0,0,0,0,0,0,0,0,0,0,0,0,0,0,0,0,0,0,0,0,0,0,0,0,0,0,0,0,0,0,0,0,0,0,0,0,0,0,mechanic/geomet,0,0,0,0,0,0,1,0,0,0,0,0,0,0,0,0,0,0,0,0,0,0,0,0,0,0,0,0,0,0,0,0,0,0,0,0, カプリコ の あたまトッピングオレオムースシリーズ 美味しい こちら は 苺 ジュレ をのせ て 素敵レシピ アップ 感謝 やっと作れ ました 苺 オレオヤバいわ超 美味 またまた つくりました 。 めっちゃ おいしー 
0.015384615,0,0,0,0.123076923,0,0,0.615384615,0,0.092307692,0,0,0.153846154,['ゼラチン ムース'],口どけふんわりプラムのムース,4649747,0,高級プラム《貴陽》を贅沢に使ったムースです酸味と甘味のバランスがいいサッパリ味♪完熟プラムで、ぜひお試しあれ,"{'プラム《貴陽》': ['3個'], 'レモン汁': ['小さじ1/2'], '湯': ['50cc'], '森永クックゼラチン': ['1袋(5g)'], '生クリーム(乳脂肪分45%)': ['200cc'], '砂糖': ['40g'], '※ヨーグルト': ['適宜(小さじ6)'], '※ミントの葉': ['適宜(6枚)']}",,2,0,1,0,0,0,0,0,0,0,0,0,0,0,0,0,0,0,0,0,0,0,0,0,0,0,0,0,0,0,0,0,0,0,0,0,0,0,0,0,0,0,0,mechanic/geomet,0,0,0,0,0,0,0,0,1,0,0,0,0,0,0,0,0,0,0,0,0,0,0,0,0,0,0,0,0,0,0,0,0,0,0,0, 
0.052325581,0,0,0,0,0.058139535,0,0.19379845,0,0.484496124,0,0,0.19379845,['ゼラチン ムース'],食べ過ぎ注意、ジャム入りヨーグルトムース,4580253,0,口の中でスーッと溶けてしまうライトなムース。美味しいからって食べ過ぎないように注意して下さいね～,"{'粉ゼラチン': ['大さじ1'], '粉ゼラチン用の水': ['大さじ3'], '好みのジャム': ['100グラム'], 'プレーンヨーグルト': ['250グラム'], '生クリーム': ['100cc'], '卵白': ['1個分']}",,1,0,0,0,0,0,0,0,0,0,0,0,0,0,0,0,0,0,0,0,0,0,0,0,1,0,0,0,0,0,0,0,0,0,0,0,0,0,0,0,0,0,0,mechanic/geomet,0,0,0,0,0,0,0,0,0,0,0,0,0,0,0,0,0,0,0,0,0,0,0,0,0,0,0,0,0,0,0,0,0,0,0,0, 
0.010204082,0,0,0,0,0.06122449,0,0.204081633,0,0.510204082,0,0.051020408,0.163265306,['ゼラチン ムース'],ヨーグルトムース,4529160,3,ふわふわ食感の、まろやかなヨーグルトムース。軽い食感と、爽やかな甘さで、暑い季節にぴったりなスイーツが出来ました。,"{'ヨーグルト': ['250g'], 'はちみつ': ['40g'], 'グラニュー糖': ['10g'], '粉ゼラチン': ['5g'], '水': ['25g'], '生クリーム': ['100g'], '卵白': ['1個分(約35g)'], 'グラニュー糖(メレンゲ用)': ['30g']}",ふわっふわで美味！リピ決定!( *´艸｀)ミックスベリーのせました。本当にふわっふわで美味しかったです！爽やかな味で、ご飯後のデザートに最適！手土産にもでき、感謝です！,3,0,3,0,0,0,0,1,0,0,0,0,0,0,0,0,0,0,0,0,0,0,0,0,0,0,0,0,0,0,0,0,0,0,0,0,0,0,0,0,0,0,0,mechanic/geomet,0,0,0,0,0,0,0,0,0,0,0,0,0,0,0,0,0,0,0,0,0,0,0,0,0,0,0,0,0,0,0,0,0,0,0,0, ふわっふわ で 美味 リピ決定 艸 ミックスベリー のせ ました 。 本当に ふわっふわ で 美味しかったです 爽やかな 味 で 、 ご飯後 の デザート に 最適 手土産 に も でき 、 感謝 です 
0.010526316,0,0,0,0.063157895,0.063157895,0,0.210526316,0.442105263,0,0,0,0.210526316,['ゼラチン ムース'],ふわとろ～食感カルピスムース,4549558,2,甘酸っぱいカルピスのふわふわムースお口の中でとろけます,"{'カルピス(原液)': ['１００ｃｃ'], '生クリーム': ['１００ｃｃ'], '牛乳': ['２００ｃｃ'], '砂糖': ['３０ｇ'], '卵白': ['１個'], 'ゼラチン': ['５ｇ'], '湯(６０度以下）': ['大匙３'], 'キウイ': ['２個'], 'いちご（あれば）': ['１０粒']}",リピです！！縁が汚れてますが、瓶に入れました。美味しいです牛乳たっぷりなのでカルピス苦手な母も食べれました！レシピに感謝,2,0,1,0,0,0,0,0,0,0,0,0,0,0,0,0,0,0,0,0,0,0,0,0,0,0,0,0,0,0,0,0,0,0,0,0,0,0,0,0,0,0,0,mechanic/geomet,0,0,0,0,0,0,0,0,0,0,0,0,0,0,0,0,0,0,0,0,0,0,0,0,0,0,0,0,0,0,0,0,0,0,0,0, リピ です 縁 が 汚れ て ます が 、 瓶 に 入れ ました 。 美味しい です 牛乳 たっぷり なので カルピス 苦手な 母 も 食べれ ました レシピ に 感謝 
0.010309278,0,0,0,0.082474227,0,0,0.103092784,0,0.618556701,0,0.06185567,0.12371134,['ゼラチン ムース'],超かんたん　ヨーグルトムース,4507214,4,毎日食べるヨーグルトがちょっとの手間でオシャレなデザートに!,"{'無糖ヨーグルト': ['300g'], '砂糖': ['40g'], 'お好きなジャム': ['60g'], 'ゼラチン': ['5g'], '水': ['大さじ2'], '(生クリーム)': ['50g']}","ホイッパーで手動で混ぜましたがフワフワ！
味もバッチリ！
いちごを混ぜて、残りを散らしました。簡単ですね！フープロで作ってもムース状に！濃厚で家族にも好評。感謝ですふんわりだけど濃厚なお味で家族にも好評でした♪",2,0,2,0,0,0,0,0,0,0,0,0,0,0,0,0,0,0,0,0,0,0,0,0,0,0,0,0,0,0,0,0,0,0,0,0,0,0,0,0,0,0,0,mechanic/geomet,0,0,0,0,0,0,0,0,0,0,0,0,0,0,0,0,0,0,0,0,0,0,0,0,0,0,0,0,0,0,0,0,0,0,0,0, ホイッパー で 手動 で 混ぜ ました が フワフワ 味 も バッチリ いちご を 混ぜ て 、 残り を 散らし ました 。 簡単 ですね フープロ で 作って も ムース 状 に 濃厚 で 家族 に も 好評 。 感謝 です ふんわり だけど 濃厚 な お味 で 家族 に も 好評でした 
0.012711864,0,0,0,0,0,0,0.127118644,0,0,0,0.423728814,0.436440678,['ゼラチン ムース'],ふんわり白身魚ムース～温玉添え～,4499141,0,卵白消費レシピ！温玉と合わさり、濃厚クリーミー！,"{'温玉': ['１個分'], 'はんぺん': ['５０ｇ'], '白身魚': ['５０ｇ'], 'おろし生姜': ['ひとつまみ'], '生クリーム': ['３０ｍｌ'], '■': ['ジュレ'], 'コンソメ顆粒': ['３ｇ'], 'ゼラチンパウダー': ['３ｇ'], '梅干し': ['１個'], '水': ['１００ｍｌ']}",,3,0,1,0,0,0,0,0,0,0,0,0,0,0,0,0,0,0,0,0,0,0,0,0,0,0,0,0,0,0,0,0,0,0,0,0,0,0,0,0,0,0,0,mechanic/geomet,0,0,0,0,1,0,0,0,0,0,0,0,0,0,0,0,0,0,0,0,0,0,0,0,0,0,0,0,0,0,0,0,0,0,0,0, 
0.018587361,0,0,0,0.033457249,0,0,0.371747212,0.390334572,0,0,0,0.185873606,['ゼラチン ムース'],バナナと小松菜のふわふわお野菜ムース,4477537,1,小松菜の鮮やかな緑色が綺麗なムースバナナの甘味が優しくお野菜嫌いの子供さんもパクパク食べてくれるデザートです,"{'小松菜': ['1株'], 'バナナ': ['1本'], '砂糖': ['大さじ1～(バナナの甘さをみて調整)'], '粉ゼラチン': ['5g'], 'お湯': ['50g'], '牛乳': ['100ml'], '生クリーム': ['100ml']}",2時児初ムース。もっといっぱいと欲張っていました。,1,0,1,0,0,0,0,0,0,0,0,0,0,0,0,0,0,0,0,0,0,0,0,0,0,0,0,0,0,0,0,0,0,0,0,0,0,0,0,0,0,0,0,mechanic/geomet,0,0,0,0,0,0,0,0,0,0,0,0,0,0,0,0,0,0,0,0,0,0,0,0,0,0,0,0,0,0,0,0,0,0,0,0, 時児 初 ムース 。 もっと いっぱい と 欲張っ てい ました 。 
0.019851117,0,0,0,0.186104218,0,0,0.496277916,0,0,0,0.148883375,0.148883375,['ゼラチン ムース'],簡単☆さっぱりレモンムース,4449179,3,ふんわり☆さっぱり 簡単にできるレモンムースです!!ふんわり食感がやみつきになりますよぜひ一度作ってみてください♪,"{'レモン汁(果汁)': ['60ml'], '生クリーム': ['200g'], '砂糖': ['75g'], 'はちみつ': ['大さじ1'], '水': ['大さじ4'], 'ゼラチン': ['8g']}",さっぱりしてて美味しかったです(о´∀`о)メロンソーダゼリーと合わせてさっぱりしてて美味！さっぱりしてて、美味しかったです♪今の季節にピッタリ!,2,0,2,0,0,0,0,0,0,0,0,0,0,0,0,0,0,0,0,0,0,0,0,0,0,0,0,0,0,0,0,0,0,0,0,0,0,0,0,0,0,0,0,mechanic/geomet,0,0,0,0,0,0,0,0,0,0,0,0,0,0,0,0,0,0,0,0,0,0,0,0,0,0,0,0,0,0,0,0,0,0,0,0, さっぱりして て 美味しかったです メロンソーダゼリー と 合わせ て さっぱりして て 美味 さっぱりして て 、 美味しかったです 今 の 季節 に ピッタリ 
0.025,0,0,0,0,0,0,0.125,0.0375,0.375,0,0.0375,0.15,['ゼラチン ムース'],ふわっ♪ヨーグルトみるくムース,4429336,1,ゼラチンで冷やし固めましたが、ふわっと、ムースのようですチョコ味の生クリームを絞り、バナナを添えました。,"{'■': ['生チョコクリーム'], '生クリーム': ['100cc'], '板チョコ(ホワイト)': ['1枚(40g)'], '●プレーンヨーグルト': ['150g'], '●練乳': ['大さじ1'], '○ゼラチン': ['1/2袋(25g)'], '○水': ['大さじ1'], '◎生クリーム': ['50cc'], '◎チョコレート(スイート)': ['20g']}",ヨーグルトが足りない分 牛乳を足しましたが ふんわりホワイトチョコ入で美味しかったです。サイダー味の紫陽花ゼリーを乗せました。,1,0,4,0,0,0,0,0,0,0,0,0,0,0,0,0,0,0,0,0,0,0,0,0,0,0,0,0,0,0,0,0,0,0,0,0,0,0,0,0,0,0,0,mechanic/geomet,0,0,0,0,0,0,0,0,0,0,0,0,0,0,0,0,0,0,0,0,0,0,0,0,0,0,0,0,0,0,0,0,0,0,0,0, ヨーグルト が 足りない分 牛乳 を 足し ました が ふんわり ホワイトチョコ 入 で 美味しかったです 。 サイダー 味 の 紫陽花 ゼリー を乗せ ました 。 
0.013157895,0,0,0,0.118421053,0,0,0.263157895,0,0.263157895,0,0.078947368,0.263157895,['ゼラチン ムース'],いちごのムース,4392817,1,旬のイチゴをたっぷり使ったデザート。,"{'いちご': ['100g'], 'プレーンヨーグルト': ['100g'], '生クリーム': ['100cc'], '砂糖': ['45g'], 'レモン汁': ['小さじ2'], 'ゼラチン': ['3～5g'], '水': ['大さじ2']}",春休み娘が作りましたぁ～ いちごの味がしっかりしてなめらか美味！,2,0,0,0,1,0,0,0,0,0,0,0,0,0,0,0,0,0,0,0,0,0,0,0,0,0,0,0,0,0,0,0,0,0,0,0,0,0,0,0,0,0,0,mechanic/geomet,1,0,0,0,0,0,0,0,0,0,0,0,0,0,0,0,0,0,0,0,0,0,0,0,0,0,0,0,0,0,0,0,0,0,0,0, 春休み 娘 が 作りました ぁいちごの 味 が しっかり して なめらか 美味 
0.009126467,0,0,0,0.065189048,0,0,0.260756193,0.273794003,0,0,0,0.391134289,['ゼラチン ムース'],WECKで　苺のムース,4327015,1,混ぜて冷やすだけで作れる、ふんわり苺ムースです。スライスした苺で見た目もオシャレに春らしく。火も使わないので簡単です。,"{'苺': ['300g'], '生クリーム': ['200cc'], '牛乳': ['200cc'], '砂糖': ['50g'], 'ゼラチンパウダー': ['7g']}",参考にさせて頂きました☆とっても美味しくて家族からも好評でした！,1,0,1,0,0,0,0,0,0,0,0,0,0,0,0,0,0,0,0,0,0,0,0,0,0,0,0,0,0,0,0,0,0,0,0,0,0,0,0,0,0,0,0,mechanic/geomet,0,0,0,0,0,0,0,0,0,0,0,0,0,0,0,0,0,0,0,0,0,0,0,0,0,0,0,0,0,0,0,0,0,0,0,0, 参考 に させて頂きました とっても 美味しくて 家族 から も 好評でした 
